{
  "SchemaVersion": 1,
  "Metadata": {
    "TrackId": "desert_oasis",
    "DisplayName": "Oasis Dunes Speedway",
    "Description": "Migrated from the original Pixel Racer: Desert Sands & Oasis Road",
    "Author": "Pixel Racer",
    "Tags": [
      "legacy-migration",
      "easy",
      "sand"
    ]
  },
  "Topology": "Circuit",
  "bInfiniteCanvas": true,
  "ChunkSize": 2048,
  "RoadSplines": [
    {
      "Name": "Main Road",
      "bClosedLoop": true,
      "ControlPoints": [
        {
          "Location": {
            "X": 600,
            "Y": 1000,
            "Z": 0
          },
          "Width": 180,
          "SpeedScale": 1.0,
          "SurfaceId": "sand",
          "ElevationLayer": 0,
          "bManualWidth": false,
          "bAllowCrossing": false
        },
        {
          "Location": {
            "X": 600,
            "Y": 1900,
            "Z": 0
          },
          "Width": 180,
          "SpeedScale": 1.0,
          "SurfaceId": "sand",
          "ElevationLayer": 0,
          "bManualWidth": false,
          "bAllowCrossing": false
        },
        {
          "Location": {
            "X": 800,
            "Y": 2400,
            "Z": 0
          },
          "Width": 180,
          "SpeedScale": 0.75,
          "SurfaceId": "sand",
          "ElevationLayer": 0,
          "bManualWidth": false,
          "bAllowCrossing": false
        },
        {
          "Location": {
            "X": 1300,
            "Y": 2700,
            "Z": 0
          },
          "Width": 180,
          "SpeedScale": 0.8,
          "SurfaceId": "sand",
          "ElevationLayer": 0,
          "bManualWidth": false,
          "bAllowCrossing": false
        },
        {
          "Location": {
            "X": 2000,
            "Y": 2600,
            "Z": 0
          },
          "Width": 180,
          "SpeedScale": 0.9,
          "SurfaceId": "sand",
          "ElevationLayer": 0,
          "bManualWidth": false,
          "bAllowCrossing": false
        },
        {
          "Location": {
            "X": 2600,
            "Y": 2300,
            "Z": 0
          },
          "Width": 180,
          "SpeedScale": 0.75,
          "SurfaceId": "sand",
          "ElevationLayer": 0,
          "bManualWidth": false,
          "bAllowCrossing": false
        },
        {
          "Location": {
            "X": 3000,
            "Y": 1800,
            "Z": 0
          },
          "Width": 180,
          "SpeedScale": 0.8,
          "SurfaceId": "sand",
          "ElevationLayer": 0,
          "bManualWidth": false,
          "bAllowCrossing": false
        },
        {
          "Location": {
            "X": 3100,
            "Y": 1100,
            "Z": 0
          },
          "Width": 180,
          "SpeedScale": 0.85,
          "SurfaceId": "sand",
          "ElevationLayer": 0,
          "bManualWidth": false,
          "bAllowCrossing": false
        },
        {
          "Location": {
            "X": 2800,
            "Y": 600,
            "Z": 0
          },
          "Width": 180,
          "SpeedScale": 0.7,
          "SurfaceId": "sand",
          "ElevationLayer": 0,
          "bManualWidth": false,
          "bAllowCrossing": false
        },
        {
          "Location": {
            "X": 2200,
            "Y": 500,
            "Z": 0
          },
          "Width": 180,
          "SpeedScale": 0.85,
          "SurfaceId": "sand",
          "ElevationLayer": 0,
          "bManualWidth": false,
          "bAllowCrossing": false
        },
        {
          "Location": {
            "X": 1600,
            "Y": 700,
            "Z": 0
          },
          "Width": 180,
          "SpeedScale": 0.75,
          "SurfaceId": "sand",
          "ElevationLayer": 0,
          "bManualWidth": false,
          "bAllowCrossing": false
        },
        {
          "Location": {
            "X": 1300,
            "Y": 1200,
            "Z": 0
          },
          "Width": 180,
          "SpeedScale": 0.65,
          "SurfaceId": "sand",
          "ElevationLayer": 0,
          "bManualWidth": false,
          "bAllowCrossing": false
        },
        {
          "Location": {
            "X": 1600,
            "Y": 1600,
            "Z": 0
          },
          "Width": 180,
          "SpeedScale": 0.8,
          "SurfaceId": "sand",
          "ElevationLayer": 0,
          "bManualWidth": false,
          "bAllowCrossing": false
        },
        {
          "Location": {
            "X": 2100,
            "Y": 1600,
            "Z": 0
          },
          "Width": 180,
          "SpeedScale": 0.85,
          "SurfaceId": "sand",
          "ElevationLayer": 0,
          "bManualWidth": false,
          "bAllowCrossing": false
        },
        {
          "Location": {
            "X": 2300,
            "Y": 1200,
            "Z": 0
          },
          "Width": 180,
          "SpeedScale": 0.65,
          "SurfaceId": "sand",
          "ElevationLayer": 0,
          "bManualWidth": false,
          "bAllowCrossing": false
        },
        {
          "Location": {
            "X": 2000,
            "Y": 950,
            "Z": 0
          },
          "Width": 180,
          "SpeedScale": 0.75,
          "SurfaceId": "sand",
          "ElevationLayer": 0,
          "bManualWidth": false,
          "bAllowCrossing": false
        },
        {
          "Location": {
            "X": 1200,
            "Y": 850,
            "Z": 0
          },
          "Width": 180,
          "SpeedScale": 0.75,
          "SurfaceId": "sand",
          "ElevationLayer": 0,
          "bManualWidth": false,
          "bAllowCrossing": false
        }
      ]
    }
  ],
  "Pieces": [],
  "ProceduralZones": [],
  "Checkpoints": [],
  "GridSlots": [
    {
      "Order": 0,
      "Location": {
        "X": 600,
        "Y": 1000,
        "Z": 0
      },
      "YawDegrees": 90
    },
    {
      "Order": 1,
      "Location": {
        "X": 660,
        "Y": 920,
        "Z": 0
      },
      "YawDegrees": 90
    },
    {
      "Order": 2,
      "Location": {
        "X": 540,
        "Y": 840,
        "Z": 0
      },
      "YawDegrees": 90
    },
    {
      "Order": 3,
      "Location": {
        "X": 660,
        "Y": 760,
        "Z": 0
      },
      "YawDegrees": 90
    },
    {
      "Order": 4,
      "Location": {
        "X": 540,
        "Y": 680,
        "Z": 0
      },
      "YawDegrees": 90
    },
    {
      "Order": 5,
      "Location": {
        "X": 660,
        "Y": 600,
        "Z": 0
      },
      "YawDegrees": 90
    }
  ],
  "RacingLines": [],
  "SurfaceProfiles": [
    {
      "SurfaceId": "asphalt",
      "Friction": 1.0,
      "DriftMultiplier": 1.0,
      "MaxSpeedMultiplier": 1.0
    },
    {
      "SurfaceId": "dirt",
      "Friction": 0.82,
      "DriftMultiplier": 1.45,
      "MaxSpeedMultiplier": 0.88
    },
    {
      "SurfaceId": "sand",
      "Friction": 0.68,
      "DriftMultiplier": 1.65,
      "MaxSpeedMultiplier": 0.75
    },
    {
      "SurfaceId": "grass",
      "Friction": 0.45,
      "DriftMultiplier": 1.8,
      "MaxSpeedMultiplier": 0.55
    },
    {
      "SurfaceId": "kerb",
      "Friction": 0.95,
      "DriftMultiplier": 1.1,
      "MaxSpeedMultiplier": 0.98
    }
  ],
  "Environment": {
    "TimeOfDayPreset": "Midday",
    "WeatherPreset": "Clear",
    "SurfaceWetness": 0.0,
    "bDynamicTime": false
  },
  "Generation": {
    "Seed": 1003,
    "TargetTrackLength": 3000.0,
    "Complexity": 0.5,
    "bGenerateRoad": false,
    "bGenerateScenery": true,
    "bGenerateBarriers": true,
    "bGenerateCheckpoints": true,
    "bGenerateAILines": true,
    "bGenerateMinimap": true,
    "bGenerateThumbnail": true
  }
}