{
  "SchemaVersion": 1,
  "Metadata": {
    "TrackId": "dust_rally",
    "DisplayName": "Dust Devil Rally",
    "Description": "Migrated from the original Pixel Racer: Mud & Gravel Circuit",
    "Author": "Pixel Racer",
    "Tags": [
      "legacy-migration",
      "hard",
      "dirt"
    ]
  },
  "Topology": "Circuit",
  "bInfiniteCanvas": true,
  "ChunkSize": 2048,
  "RoadSplines": [
    {
      "Name": "Main Road",
      "bClosedLoop": true,
      "ControlPoints": [
        {
          "Location": {
            "X": 800,
            "Y": 600,
            "Z": 0
          },
          "Width": 170,
          "SpeedScale": 1.0,
          "SurfaceId": "dirt",
          "ElevationLayer": 0,
          "bManualWidth": false,
          "bAllowCrossing": false
        },
        {
          "Location": {
            "X": 1600,
            "Y": 600,
            "Z": 0
          },
          "Width": 170,
          "SpeedScale": 1.0,
          "SurfaceId": "dirt",
          "ElevationLayer": 0,
          "bManualWidth": false,
          "bAllowCrossing": false
        },
        {
          "Location": {
            "X": 2200,
            "Y": 700,
            "Z": 0
          },
          "Width": 170,
          "SpeedScale": 0.75,
          "SurfaceId": "dirt",
          "ElevationLayer": 0,
          "bManualWidth": false,
          "bAllowCrossing": false
        },
        {
          "Location": {
            "X": 2700,
            "Y": 1100,
            "Z": 0
          },
          "Width": 170,
          "SpeedScale": 0.6,
          "SurfaceId": "dirt",
          "ElevationLayer": 0,
          "bManualWidth": false,
          "bAllowCrossing": false
        },
        {
          "Location": {
            "X": 2600,
            "Y": 1600,
            "Z": 0
          },
          "Width": 170,
          "SpeedScale": 0.7,
          "SurfaceId": "dirt",
          "ElevationLayer": 0,
          "bManualWidth": false,
          "bAllowCrossing": false
        },
        {
          "Location": {
            "X": 2100,
            "Y": 1700,
            "Z": 0
          },
          "Width": 170,
          "SpeedScale": 0.8,
          "SurfaceId": "dirt",
          "ElevationLayer": 0,
          "bManualWidth": false,
          "bAllowCrossing": false
        },
        {
          "Location": {
            "X": 1600,
            "Y": 1400,
            "Z": 0
          },
          "Width": 170,
          "SpeedScale": 0.6,
          "SurfaceId": "dirt",
          "ElevationLayer": 0,
          "bManualWidth": false,
          "bAllowCrossing": false
        },
        {
          "Location": {
            "X": 1300,
            "Y": 1600,
            "Z": 0
          },
          "Width": 170,
          "SpeedScale": 0.6,
          "SurfaceId": "dirt",
          "ElevationLayer": 0,
          "bManualWidth": false,
          "bAllowCrossing": false
        },
        {
          "Location": {
            "X": 1500,
            "Y": 2000,
            "Z": 0
          },
          "Width": 170,
          "SpeedScale": 0.8,
          "SurfaceId": "dirt",
          "ElevationLayer": 0,
          "bManualWidth": false,
          "bAllowCrossing": false
        },
        {
          "Location": {
            "X": 2200,
            "Y": 2200,
            "Z": 0
          },
          "Width": 170,
          "SpeedScale": 0.85,
          "SurfaceId": "dirt",
          "ElevationLayer": 0,
          "bManualWidth": false,
          "bAllowCrossing": false
        },
        {
          "Location": {
            "X": 2800,
            "Y": 2400,
            "Z": 0
          },
          "Width": 170,
          "SpeedScale": 0.65,
          "SurfaceId": "dirt",
          "ElevationLayer": 0,
          "bManualWidth": false,
          "bAllowCrossing": false
        },
        {
          "Location": {
            "X": 2500,
            "Y": 2650,
            "Z": 0
          },
          "Width": 170,
          "SpeedScale": 0.6,
          "SurfaceId": "dirt",
          "ElevationLayer": 0,
          "bManualWidth": false,
          "bAllowCrossing": false
        },
        {
          "Location": {
            "X": 1800,
            "Y": 2600,
            "Z": 0
          },
          "Width": 170,
          "SpeedScale": 0.85,
          "SurfaceId": "dirt",
          "ElevationLayer": 0,
          "bManualWidth": false,
          "bAllowCrossing": false
        },
        {
          "Location": {
            "X": 1000,
            "Y": 2500,
            "Z": 0
          },
          "Width": 170,
          "SpeedScale": 0.75,
          "SurfaceId": "dirt",
          "ElevationLayer": 0,
          "bManualWidth": false,
          "bAllowCrossing": false
        },
        {
          "Location": {
            "X": 600,
            "Y": 2100,
            "Z": 0
          },
          "Width": 170,
          "SpeedScale": 0.65,
          "SurfaceId": "dirt",
          "ElevationLayer": 0,
          "bManualWidth": false,
          "bAllowCrossing": false
        },
        {
          "Location": {
            "X": 700,
            "Y": 1600,
            "Z": 0
          },
          "Width": 170,
          "SpeedScale": 0.8,
          "SurfaceId": "dirt",
          "ElevationLayer": 0,
          "bManualWidth": false,
          "bAllowCrossing": false
        },
        {
          "Location": {
            "X": 1000,
            "Y": 1200,
            "Z": 0
          },
          "Width": 170,
          "SpeedScale": 0.65,
          "SurfaceId": "dirt",
          "ElevationLayer": 0,
          "bManualWidth": false,
          "bAllowCrossing": false
        },
        {
          "Location": {
            "X": 800,
            "Y": 900,
            "Z": 0
          },
          "Width": 170,
          "SpeedScale": 0.7,
          "SurfaceId": "dirt",
          "ElevationLayer": 0,
          "bManualWidth": false,
          "bAllowCrossing": false
        }
      ]
    }
  ],
  "Pieces": [],
  "ProceduralZones": [],
  "Checkpoints": [],
  "GridSlots": [
    {
      "Order": 0,
      "Location": {
        "X": 800,
        "Y": 600,
        "Z": 0
      },
      "YawDegrees": 0
    },
    {
      "Order": 1,
      "Location": {
        "X": 720,
        "Y": 640,
        "Z": 0
      },
      "YawDegrees": 0
    },
    {
      "Order": 2,
      "Location": {
        "X": 640,
        "Y": 560,
        "Z": 0
      },
      "YawDegrees": 0
    },
    {
      "Order": 3,
      "Location": {
        "X": 560,
        "Y": 640,
        "Z": 0
      },
      "YawDegrees": 0
    },
    {
      "Order": 4,
      "Location": {
        "X": 480,
        "Y": 560,
        "Z": 0
      },
      "YawDegrees": 0
    },
    {
      "Order": 5,
      "Location": {
        "X": 400,
        "Y": 640,
        "Z": 0
      },
      "YawDegrees": 0
    }
  ],
  "RacingLines": [],
  "SurfaceProfiles": [
    {
      "SurfaceId": "asphalt",
      "Friction": 1.0,
      "DriftMultiplier": 1.0,
      "MaxSpeedMultiplier": 1.0
    },
    {
      "SurfaceId": "dirt",
      "Friction": 0.82,
      "DriftMultiplier": 1.45,
      "MaxSpeedMultiplier": 0.88
    },
    {
      "SurfaceId": "sand",
      "Friction": 0.68,
      "DriftMultiplier": 1.65,
      "MaxSpeedMultiplier": 0.75
    },
    {
      "SurfaceId": "grass",
      "Friction": 0.45,
      "DriftMultiplier": 1.8,
      "MaxSpeedMultiplier": 0.55
    },
    {
      "SurfaceId": "kerb",
      "Friction": 0.95,
      "DriftMultiplier": 1.1,
      "MaxSpeedMultiplier": 0.98
    }
  ],
  "Environment": {
    "TimeOfDayPreset": "Midday",
    "WeatherPreset": "Clear",
    "SurfaceWetness": 0.0,
    "bDynamicTime": false
  },
  "Generation": {
    "Seed": 1002,
    "TargetTrackLength": 3000.0,
    "Complexity": 0.5,
    "bGenerateRoad": false,
    "bGenerateScenery": true,
    "bGenerateBarriers": true,
    "bGenerateCheckpoints": true,
    "bGenerateAILines": true,
    "bGenerateMinimap": true,
    "bGenerateThumbnail": true
  }
}